{
  "schema_version": "1.0.0",
  "protocol_version": "1.0.0",
  "work_package_id": "WP-0A-CON-001",
  "agent_run_id": "/root",
  "final_status": "in_review",
  "base_revision": "aac2a387d8f158aa8e2628dc699a7d51d55b1389",
  "head_revision_or_patch_checksum": "CON-00 shared-kernel catalog and synthetic fixture candidate; commit pending",
  "task_ids": ["G0-008", "G0-009", "CM-003", "TC-001", "EV-001", "JB-001"],
  "files_added": [
    "contract-catalog/shared-kernel/index.json",
    "contract-catalog/shared-kernel/ctr-ten-001/manifest.json",
    "contract-catalog/shared-kernel/ctr-ten-001/schema.json",
    "contract-catalog/shared-kernel/ctr-ten-001/examples/valid.json",
    "contract-catalog/shared-kernel/ctr-ten-001/examples/invalid-missing-workspace.json",
    "contract-catalog/shared-kernel/ctr-err-001/manifest.json",
    "contract-catalog/shared-kernel/ctr-err-001/schema.json",
    "contract-catalog/shared-kernel/ctr-err-001/examples/valid-validation-error.json",
    "contract-catalog/shared-kernel/ctr-err-001/examples/valid-retryable-error.json",
    "contract-catalog/shared-kernel/ctr-err-001/examples/invalid-unsafe-detail.json",
    "contract-catalog/shared-kernel/ctr-evt-001/manifest.json",
    "contract-catalog/shared-kernel/ctr-evt-001/schema.json",
    "contract-catalog/shared-kernel/ctr-evt-001/examples/valid.json",
    "contract-catalog/shared-kernel/ctr-evt-001/examples/invalid-missing-tenant.json",
    "contract-catalog/shared-kernel/ctr-evt-001/examples/invalid-unsafe-payload.json",
    "contract-catalog/shared-kernel/ctr-job-001/manifest.json",
    "contract-catalog/shared-kernel/ctr-job-001/schema.json",
    "contract-catalog/shared-kernel/ctr-job-001/examples/valid.json",
    "contract-catalog/shared-kernel/ctr-job-001/examples/invalid-max-attempts.json",
    "test-kits/contracts/shared-kernel-contract-catalog.test.mjs",
    "handoffs/WP-0A-CON-001-author-catalog-handoff.json"
  ],
  "files_modified": ["work-packages/WP-0A-CON-001.json"],
  "files_deleted": [],
  "decisions_consumed": ["DEC-010", "DEC-011", "DEC-021", "DEC-022", "DEC-023", "DEC-025"],
  "contracts_consumed": ["CTR-TEN-001", "CTR-ERR-001", "CTR-EVT-001", "CTR-JOB-001"],
  "contracts_produced_or_changed": ["Candidate metadata/schema/fixture artifacts for CTR-TEN-001, CTR-ERR-001, CTR-EVT-001, and CTR-JOB-001 only; no freeze-level change."],
  "assumptions": ["The Decision Register and declared Contracts/Events/Jobs workstream are authoritative for fields represented in Candidate schemas.", "Draft shared-kernel contracts are indexed only because their detailed field semantics are not supplied by the declared baseline inputs."],
  "acceptance_results": [
    {"criterion":"Every cataloged shared-kernel entry preserves baseline ID, version, owner, consumers, status, and required-before-freeze metadata.","result":"pass; 14 unique entries, four Candidate and ten Draft."},
    {"criterion":"Candidate fixtures are synthetic and include relevant negative cases without customer data, secrets, provider SDKs, schema migration, or external calls.","result":"pass; tenant, event, job, and safe-error negative fixtures are present."},
    {"criterion":"No contract advances from Candidate/Draft to Frozen.","result":"pass; every materialized contract remains Candidate and every other shared-kernel entry remains Draft."}
  ],
  "tests": [
    {"command":"npm run check","exit_code":0,"result":"26 bootstrap/protocol tests passed under Node 24.20.0/npm 11.19.0."},
    {"command":"node --test test-kits/contracts/*.test.mjs","exit_code":0,"result":"6 catalog/fixture, candidate-safety, and required-field mutation tests passed."},
    {"command":"git diff --check","exit_code":0,"result":"working diff whitespace clean."}
  ],
  "security_privacy_cost_impact": "Synthetic catalog and fixtures only. No secret, credential, customer data, provider call, production setting, billing operation, or publish action is created.",
  "migration_and_data_impact": "None. The package does not modify schema, migrations, RLS policy, object storage, or persisted customer data.",
  "compatibility_impact": "No existing contract meaning or version changes. Candidate schemas are proposals tied to the source baseline and must not be treated as Frozen or production API contracts; Event payload semantics, Job lifecycle/receipt semantics, and reference syntax remain pending owner approval.",
  "known_limitations": ["The repository has no JSON Schema runtime dependency; the deterministic kit validates catalog identity, fixture presence, and explicit negative-case invariants rather than implementing a general JSON Schema engine.", "Draft shared-kernel entries remain metadata-only until their source-defined field semantics and owner approvals are available."],
  "open_risks_or_blockers": ["G0 remains Specification Baseline Complete / External Verification Pending.", "Contract freeze, downstream schema/RLS work, provider integration, and production use remain blocked by their existing source-defined gates and owners."],
  "rollback_or_forward_fix": "Revert this catalog/fixture-only commit or issue a reviewed forward correction. No external or persisted state requires recovery.",
  "recommended_next_work_packages": ["Use this Candidate catalog only for scoped synthetic fixtures/spikes until the source-defined contract freeze and G0 gates are satisfied.", "Do not infer permission to implement DB-00/JOB-00 production behavior, provider integration, production schema, or external operations from this handoff."],
  "reviewer_instructions": ["Check every materialized field against the declared baseline source; request change rather than infer missing semantics.", "Verify fixtures contain no secrets, customer data, raw provider response, permanent URL, or undocumented production behavior.", "Verify Candidate/Draft status remains unchanged and no output escapes CON-00 ownership."]
}
